,fname,text
0,blog post 1.txt,"blog post 1.txt. How To Tackle B2B Marketing Attribution in 2023 As customer journeys become more complex and multichannel, and marketers employ more advanced strategies like omnichannel marketing, ABM, and personalization, the need for accurate and precise analytics with B2B marketing attribution as its centerpiece becomes more evident. Still, in 2022, a striking 58% of B2B marketers reported that their marketing analytics is inadequate or needs improvement. This article provides actionable insights and strategies to help you better understand the concepts, tools, and best practices of B2B marketing attribution. Whether you're just starting or refining your strategy, this guide will serve as a valuable resource for achieving marketing attribution success in 2023. What Is a B2B Marketing Funnel? Throughout the time consuming B2B sales funnel, a decision maker may come in contact with many of your marketing efforts. One single person might do all of the following things: See your Facebook ad Find your blog while searching a keyword on Google Download an eBook from your website Receive retargeting ads from Google Display View your Capterra ad while reading software reviews Get entered into your email nurture campaign Click on your branded Google ad Schedule a demo based off an email from your sales team Watch a webinar you sent via marketing emails And the list goes on. As a fellow marketer, I too am met with this challenge of attribution: determining where exactly my customers are coming from, which marketing efforts are having a positive impact and how to give each channel proper credit. I will walk you through how our marketing team implemented B2B marketing attribution. How to Build a B2B Marketing Attribution Model in 7 Steps Below are the 7 steps you need to take in order to execute B2B marketing attribution. Choose a source of truth. Collect event data about leads from your website. Connect each website lead with the channel they came from. Connect all leads at the Company level in your CRM or database. Define your attribution model Visualize your attribution model Pull actionable insights from your data I will provide more detail about each of these steps below. A visual schema of our B2B Marketing Attribution Model at Improvado. Step 1: Choose a source of truth. The first thing you need to do is choose a source of truth for your business. For example, your CRM or database can be used as your source of truth. For us at Improvado, our source of truth is Salesforce. Step 2: Collect event data about leads from your website. The next thing you need to do is make sure you are tracking leads who visit your website, and sending all that data to your source of truth. For example, we host our website on Webflow and we track events on our website using Mixpanel. We then use the Mixpanel API to send event data into our source of truth, which is Salesforce. What does it mean to track events? Events include every move a visitor makes on your website, including link clicks and page visits. For example, in the screenshot below, you can see how we use Mixpanel to see that this individual downloaded a resource on our website and they were referred from google.com and we can even see their email and other actions they have taken on our site. ‍ Step 3: Connect each website lead with the channel they came from. You can do this in a number of ways. At Improvado, we do this by looking at the UTM attributes tied to a visitor's link or by looking at the ""Initial Referring Domain"" (if no UTM is visible). Step 4: Connect all leads at the Company level in your CRM or database. Often times there are multiple leads tied to one business. For example at Improvado, we have multiple ""Contacts"" connected to an ""Account"" in Salesforce. Step 5: Define your attribution model Depending on your team goals, you might decide to focus on a first click, last click, time decay, position based, or linear attribution model. Each of these attribution models gives different weight to channels based on where the interaction occurred in the customer journey. At Improvado we use a position based attribution model.  Step 6: Visualize your attribution model Send data from your source of truth to a Business Intelligence tool like Tableau, Looker, Google Data Studio or PowerBI, so that you can create visualizations of your marketing attribution model. Sync this data automatically using Improvado's API to send all your real-time marketing data (which includes paid channels, event tracking and sales data from Salesforce) into your visualization tool of choice. That way, it is easy to create visualizations that show your marketing attribution and performance over time. With Improvado, all it takes is a few clicks to send all this important data exactly where it needs to go, so we can visualize and share important insights with the team. Click here to try Improvado for yourself.‍ ‍ Improvado allows you to view all of your marketing performance data in one place. For example, the screenshot below shows how we are able to view spend and performance data from Twitter, Google Adwords, Facebook, Bing and Amazon Sponsored Placements side by side. Step 7: Pull actionable insights from your data We were able to use our position based attribution model to uncover which channels were generating the largest amount of revenue opportunities for our business. As you can see in the screenshot below, SEO drives a majority of our revenue opportunities and therefore we decided to triple down on content as a growth channel at Improvado and cut back on Facebook ad spend. This is what we like to call data-driven actionable insights.  Conclusion Setting up an automated B2B attribution system has allowed our team to see exactly which marketing efforts have led to opportunities and closed won deals. This allows us to optimize campaigns by funneling more budget into what works and cutting the cord on what doesn’t. With clearer insight into performance, we have been able to use our budget and time more efficiently on the channels that work best to increase ROI. "
1,blog post 10.txt,"blog post 10.txt. KPI Dashboards: What They Are and How to Build One Creating key performance indicators (KPIs) is one thing. Understanding how to read those KPIs and effectively track progress toward their completion is another. Displaying all KPIs on a single dashboard helps you create a coherent data story to help teams reach and exceed their goals. Without the dashboard, it’s often hard to see the forest for the trees and confidently navigate through all objectives. Ready to learn more about KPI dashboards and explore how to build one for yourself? Then, let’s dive in. Key Takeaways KPI dashboards combine data from various sources and display key insights using visual elements such as charts and graphs. Effective KPI dashboards are focused and goal-centric, including only the data end-users need to answer KPI-specific business queries. Some key benefits of KPI dashboards include facilitating executive decision-making, identifying opportunities and underperformance, increasing team collaboration and transparency, and facilitating real-time data analysis at scale. To create a KPI dashboard, first choose the KPIs and metrics to track. Then select the relevant data sources. Once you’ve identified these, visualize the data using relevant charts and graphs. Lastly, share the dashboard. Follow best practices to build KPI dashboards that everyone trusts. Include only data relevant to the goals, use text and interactive elements effectively, be visually consistent, keep it simple, and use good-quality data. Analytics tools like Improvado can automatically sync all your data from different sources, ensure all your data has satisfactory quality, and provide you with a KPI dashboard that will serve as a single source of truth for your teams. What Are KPI Dashboards? Improvado’s KPI dashboard template KPIs or key performance indicators are measurements that track how well a company, department, team, or person is progressing toward a goal. In other words, they are success metrics calculated based on data from different sources. KPI dashboards show progress on KPIs in a visual, easily digestible format to help inform business decisions. Real-time dashboards automate any manual data wrangling processes, allowing teams to focus on uncovering insights into their goal progress. KPI dashboards are a necessary foundation for teams and companies that want to join the data-driven side. However, ensuring you use good-quality data to avoid false insights is vital. What Do KPI Dashboards Include? A KPI dashboard includes all the relevant data end users need to make data-driven decisions for ultimate goal achievement and to adjust their strategy on the go. The included metrics depend on the dashboard’s audience. What’s their goal? What question do they want to have answered? Which KPIs are important for the audience to gauge performance? What data can best help them get actionable business insights? Once you’ve determined these variables, choose all the relevant data you need to include in the dashboard. Use various visualization techniques, such as trend analysis over time and comparatives and benchmarks, to provide more context. Also, add annotations to the visuals to help describe the data to the end user. Improvado’s cross-channel KPI dashboard Key Business Benefits of KPI Dashboards Data is only useful when you can make sense of it. However, making sense of it gets increasingly complicated with the growing amount of data you collect. That’s what KPI dashboards help you with. Let’s review how exactly this is achieved. Facilitates effective executive decision-making With a KPI dashboard, executives don’t have to wait for different departments to report on their activities and performance. All of this information is stored in a single source of truth for the company’s KPIs. Executives have a real-time view of each team’s performance and contribution to the organization’s bottom line. This means they can see which units and processes to focus on to achieve business goals faster. Improves operational efficiency and effectiveness KPI dashboards streamline organizational workflow, making it easy for employees to work efficiently. Let’s say the marketing team needs data on the lead-to-customer conversion rate from the sales team or the customer satisfaction index score from the customer support team. In these cases, they can get this info from the KPI dashboard without waiting for someone to hand them the data, stopping the time-consuming back and forth between different parties. Increases collaboration and transparency between teams With a shared KPI dashboard of real-time data, teams can easily make decisions without waiting for another person’s input. This democratizes data, fostering collaboration and accelerating communication, ultimately leading to better team alignment and happier employees. Facilitates real-time data analysis at scale The real-time delivery of KPI dashboards gives executives insights into business operations as they happen. Using a dashboard's interactive elements, they can drill down into each specific KPI without going through many spreadsheets or wading through different programs. Provides valuable data for predicting business growth KPIs tell you how you're progressing toward a goal. With a KPI dashboard, you have a tool that helps you assess the direction your business is heading. You can better see patterns and forecast business growth—and with that, decide the next steps that will allow you to reach your business objectives efficiently. Provides insights on what to prioritize Data overwhelm is a huge problem for many decision-makers. Having dashboards on relevant KPIs—fueled by good-quality data— means you can better analyze business operations without being overwhelmed. Since dashboards properly organize and visualize critical information, you can quickly identify what to focus on and prioritize. Steps for Creating KPI Dashboards Developing a KPI dashboard is an intricate and time-consuming activity. But, not for those who know the right steps and use the right tools to visualize KPIs. Choose the KPIs and metrics to track What questions do end-users want to have answered and what information do they need? Consider this when creating a KPI dashboard, so you don't end up featuring vanity metrics. Focus only on the most crucial metrics for the monitored activity. For example, if you’re building a sales pipeline dashboard, you definitely don’t need to include CLTV or CPA, because salespeople have almost nothing to do with these metrics. Most KPI dashboards use the MAD framework—a three-level approach to creating dashboards. It includes the monitor level for high-level KPIs like annual recurring revenue or relative market share, the analysis level for analyzing KPIs across various departments, and the drill level for detailed KPIs for deep-dive analysis. Select relevant data sources Evaluate all your available data sources and decide which ones are relevant. This isn't always straightforward, especially with the many tools businesses use nowadays. Choose data sources wisely because each new one comes with engineering and maintenance hassles. You’ll have to connect each source to your dashboarding tool, fetch the right data, transform it into a digestible form, and come up with new charts to visualize it. Not to mention that data sources come with unique APIs which require frequent updates on the back-end. A better option is to connect all required data sources with an automated analytics platform. For example, Improvado integrates with 500+ different marketing and sales data sources to quickly extract data and streamline it to a dashboard tailored to the user’s objectives. With Improvado’s plug-and-play approach, you can jumpstart your analytics and scale it as you go by adding data sources from the library. Get a KPI dashboard without data hassle Schedule a consultation to discuss your analytics goals with our product expert. On a 30-min call, we’ll identify your business objectives and come up with a dashboard prototype tailored to your use case. Schedule a call Create suitable charts and graphs KPI dashboard for paid ads by Improvado Data visualization is no less important a task than data collection. Your main challenge is to come up with the right way to narrate your story with charts and graphs. For example, if you want to compare values, use bar charts and scatter plot charts. For analyzing trends, line and column charts are ideal. You can use charts like Mekko/Marimekko to understand data distribution. Yet again, building your visualization from scratch requires analytical know-how and experience with business intelligence tools. But you can take the easy path. Improvado offers a variety of dashboard templates for your marketing and sales data. You don’t have to create any charts. Just connect the data sources, choose a template, and modify the charts however you want. That’s how you save time on dashboard development while having the same flexibility provided by business intelligence tools. Schedule a quick call to check Improvado’s KPI dashboard template and learn how it can be customized for your needs Share the dashboard Give access—with the appropriate permissions—to everyone who needs to see the KPI dashboard. You can also export it into a PDF document for sharing through emails, meetings, or presentations. Best Practices to Build a KPI Dashboard Creating effective KPI dashboards becomes easier when you follow some best practices. Include only KPIs relevant to the goals Always be aware of the audience and why they need a KPI dashboard. What do they want to know? What KPIs do they need to compare and contrast? Building the dashboard with your audience in mind will reveal what information should be included. Use text effectively Your data is telling a story. As much as the charts and graphs illustrate that, so does the language you use for labeling and descriptions. Get clear on the insights you want to get across using well-thought-out annotation principles. Clearly label interactive elements and make it obvious that they are clickable or drillable. Aim for visual consistency Having a nice-looking KPI dashboard is a key element of effective dashboards. Your ultimate goal is to display data that key people in the organization can quickly get insights into. One way to do this is by sticking to consistent colors and styles and applying visual design principles. Keep it simple It's easy to get excited about the various charts and graphs you can make out of all your data, but clutter ruins KPI dashboards. Make them as simple as possible. Overcrowding with irrelevant data—no matter how interesting—will only distract from the narrative you're trying to convey. Ensure you’re using clean data KPI dashboards make data easy to understand. But it's of no use if this data is from poor-quality sources. Before creating a dashboard, ensure that the integrity and accuracy of your data are sound. How to Create a KPI Dashboard with Improvado Creating a KPI dashboard is a time suck, although an extremely valuable time suck. If you do everything right, from data collection to styling your charts, you get a single source of truth for any of your business activities. Marketing analytics platforms make the process 10X easier. You just plug in the required data sources, choose the metrics you want to track, then choose a dashboard template that suits you. The main difference between using Improvado and building a dashboard yourself is that we’ve got everything done for you. You only have to choose what you want to see on the dashboard and how you would like to see it. Improvado mostly caters to enterprises and middle-market companies because of the provided level of flexibility and data granularity. Use the power of an extensive library with 500+ data sources. Any integration, metrics, or dimension beyond Improvado’s library can be developed on demand. Improvado doesn’t hold your data hostage. If you decide to leave, the data is all yours, don’t worry about losing it. Improvado’s team of analytics experts will gladly help with any of your analytical complexities, from dashboard customization to querying data in GBQ. Global brands, such as ASUS, Activision, and Illy choose Improvado for advanced features, a large catalog of data source connectors, endless customization options, and fast data processing. Book a consultation with an Improvado expert to learn how the solution can streamline all your KPI data into a comprehensive dashboard. "
